{"approval_max_seconds":86400,"approval_path_prefix":"approvals/","approval_schema_version":2,"artifact_transport":"private-untrusted-carrier","carrier_authorizes_release":false,"carrier_repository":"PluckXD/tratto-control-release-carrier","carrier_trust":"transport-only","controller":{"immutable_release_required":true,"repository":"PluckXD/tratto-control-release","repository_id":0,"require_owner_enforcement":true,"signed_annotated_tag_required":true,"tag_ref_pattern":"^refs/tags/control-controller-v6\\.(0|[1-9][0-9]*)\\.(0|[1-9][0-9]*)$","tag_ref_prefix":"refs/tags/control-controller-v6.","tag_signature_claim_authorizes_release":false,"tag_signature_trust_root_sha256":"","tag_signature_verification_mode":"local-cryptographic-annotated-tag-object","tag_signature_verifier_sha256":"","workflow_path":".github/workflows/control-release.yml","workflow_sha256":""},"controller_repository":"PluckXD/tratto-control-release","ledger":{"append_only":true,"approval_schema_version":2,"genesis_sha":"","linear_single_parent":true,"ref":"refs/heads/main","repository":"PluckXD/tratto-control-release-ledger","repository_id":0,"require_unchanged_head_at_signature":true,"signer_revalidation_timing":"immediately-before-signature"},"migration_database_scope":"control-and-tenant-fleet","product_repositories":["PluckXD/tratto-api","PluckXD/tratto-web"],"required_ref":"refs/heads/main","runtime_policy":{"digest_sha256":"c34e2b5655ed2df968b4f976db223bb9653a58e4aacce65f28300cb06b5dc5ae","name":"control-runtime-v1","path":"policies/control-runtime-v1.json"},"schema_version":2,"signer_allows_product_credentials":false,"signer_allows_source_checkout":false}
